{"approvals":[{"approved_case_hash":"b2ec4a2a1bfdbbf3a3495d1c0a3fa6c347b42a45ab627bb8b1b0e39cdd3c4214","approved_patch_hash":"963f6ed66a7f71f7ee3699d53485e72dca9fea455581bdf111414ad6dd3b11ab","case_id":"QCI-NHTSA-24V152-SYN-001","comment":"规格与验证证据一致","decision":"APPROVED","event_id":"ECO-SYN-001","event_revision":"2","role":"QUALITY_MANAGER"},{"approved_case_hash":"b2ec4a2a1bfdbbf3a3495d1c0a3fa6c347b42a45ab627bb8b1b0e39cdd3c4214","approved_patch_hash":"963f6ed66a7f71f7ee3699d53485e72dca9fea455581bdf111414ad6dd3b11ab","case_id":"QCI-NHTSA-24V152-SYN-001","comment":"现场作业内容可执行","decision":"APPROVED","event_id":"ECO-SYN-001","event_revision":"2","role":"PROCESS_OWNER"}],"description":"经人工批准，同步SOP规格与版本，并让检验记录引用新SOP。","operations":[{"document_id":"SOP-AXLE-SYN","op":"set","path":"revision","value":"B2"},{"document_id":"SOP-AXLE-SYN","op":"set","path":"revision_date","value":"2024-02-05"},{"document_id":"SOP-AXLE-SYN","op":"set","path":"fields.characteristics","value":[{"characteristic_id":"CTQ-NUT-SEAT-SPATTER","locator":"CSV#row-2.cell-B","process_step_id":"WELD-10","specification":{"maximum":0,"minimum":0,"target":0,"unit":"visible_particle"}}]},{"document_id":"IR-AXLE-SYN","op":"set","path":"revision","value":"B2"},{"document_id":"IR-AXLE-SYN","op":"set","path":"revision_date","value":"2024-02-06"},{"document_id":"IR-AXLE-SYN","op":"set","path":"fields.characteristics","value":[{"characteristic_id":"CTQ-NUT-SEAT-SPATTER","locator":"CSV#row-2.cell-B","process_step_id":"WELD-10","specification":{"maximum":0,"minimum":0,"target":0,"unit":"visible_particle"}}]},{"document_id":"IR-AXLE-SYN","op":"set","path":"fields.references","value":{"CONTROL_PLAN":{"document_id":"CP-AXLE-SYN","document_type":"CONTROL_PLAN","revision":"B","source_hash":"84320ac715e35488a6fd572bfb727fb4ffd98408cd20038aac840d32f85d6efa"},"SOP":{"document_id":"SOP-AXLE-SYN","document_type":"SOP","revision":"B2","source_hash":"adbd3f4efa3dfb026bf63f1370176b86193f4f6627d05f68fc2176075e64dade"}}}],"replacement_set_id":"REPLACEMENT-RES-SYN-001","resolution_id":"RES-SYN-001"}